cdmTableName,databaseSchema,cdmFieldName,isRequired,isRequiredThreshold,isRequiredNotes,cdmDatatype,cdmDatatypeThreshold,cdmDatatypeNotes,userGuidance,etlConventions,isPrimaryKey,isPrimaryKeyThreshold,isPrimaryKeyNotes,isForeignKey,isForeignKeyThreshold,isForeignKeyNotes,fkTableName,fkFieldName,fkDomain,fkDomainThreshold,fkDomainNotes,fkClass,fkClassThreshold,fkClassNotes,isStandardValidConcept,isStandardValidConceptThreshold,isStandardValidConceptNotes,measureValueCompleteness,measureValueCompletenessThreshold,measureValueCompletenessNotes,standardConceptRecordCompleteness,standardConceptRecordCompletenessThreshold,standardConceptRecordCompletenessNotes,sourceConceptRecordCompleteness,sourceConceptRecordCompletenessThreshold,sourceConceptRecordCompletenessNotes,sourceValueCompleteness,sourceValueCompletenessThreshold,sourceValueCompletenessNotes,standardConceptFieldName,plausibleValueLow,plausibleValueLowThreshold,plausibleValueLowNotes,plausibleValueHigh,plausibleValueHighThreshold,plausibleValueHighNotes,plausibleTemporalAfter,plausibleTemporalAfterTableName,plausibleTemporalAfterFieldName,plausibleTemporalAfterThreshold,plausibleTemporalAfterNotes,plausibleDuringLife,plausibleDuringLifeThreshold,plausibleDuringLifeNotes,plausibleStartBeforeEnd,plausibleStartBeforeEndFieldName,plausibleStartBeforeEndThreshold,plausibleStartBeforeEndNotes,plausibleAfterBirth,plausibleAfterBirthThreshold,plausibleAfterBirthNotes,plausibleBeforeDeath,plausibleBeforeDeathThreshold,plausibleBeforeDeathNotes,runForCohort,withinVisitDates,withinVisitDatesThreshold,withinVisitDatesNotes
CONDITION_OCCURRENCE,cdm,condition_concept_id,Yes,0,,integer,0,,"The CONDITION_CONCEPT_ID field is recommended for primary use in analyses, and must be used for network studies. This is the standard concept mapped from the source value which represents a condition","The CONCEPT_ID that the CONDITION_SOURCE_VALUE maps to. Only records whose source values map to concepts with a domain of ""Condition"" should go in this table. [Accepted Concepts](https://athena.ohdsi.org/search-terms/terms?domain=Condition&standardConcept=Standard&page=1&pageSize=15&query=).",No,,,Yes,0,,CONCEPT,CONCEPT_ID,Condition,0,,,,,Yes,0,,Yes,0,,Yes,5,The majority of fails in this check are Read codes without mappings. The original 5% is still valid were those codes mapped.,No,,,No,,,,,,,,,,,,,,,No,,,,,,,,,,,,,Yes,,,
DRUG_EXPOSURE,cdm,drug_source_value,No,,,varchar(50),0,,"This field houses the verbatim value from the source data representing the drug exposure that occurred. For example, this could be an NDC or Gemscript code.",This code is mapped to a Standard Drug Concept in the Standardized Vocabularies and the original code is stored here for reference.,No,,,No,,,,,,,,,,,No,,,Yes,100,,No,,,No,,,Yes,14,Threshold updated to 14% as these represent only 1.3% of total records in the table,DRUG_CONCEPT_ID,,,,,,,,,,,,No,,,,,,,,,,,,,Yes,,,
OBSERVATION,cdm,observation_concept_id,Yes,0,,integer,0,,"The OBSERVATION_CONCEPT_ID field is recommended for primary use in analyses, and must be used for network studies.","The CONCEPT_ID that the OBSERVATION_SOURCE_CONCEPT_ID maps to. There is no specified domain that the Concepts in this table must adhere to. The only rule is that records with Concepts in the Condition, Procedure, Drug, Measurement, or Device domains MUST go to the corresponding table.",No,,,Yes,34,"Updated the thresholds to capture the expected state of mapping for the data source 2025S1",CONCEPT,CONCEPT_ID,,,,,,,Yes,0,Prior failures in this check were related to Read code 137K.00 mapping to a non-standard concept. ,Yes,0,,Yes,35,"Threshold increased to 35%. The majority of these are records from the TEST and ADDITIONAL tables that do not have mappings, though they can be mapped if a use case arises. The others are Read codes without mappings. ",No,,,No,,,,,,,,,,,,,,,No,,,,,,,,,,,,,Yes,,,
OBSERVATION_PERIOD,cdm,observation_period_end_date,Yes,0,,date,0,,Use this date to determine the end date of the period for which we can assume that all events for a Person are recorded.,"It is often the case that the idea of Observation Periods does not exist in source data. In those cases, the observation_period_end_date can be inferred as the last Event date available for the Person. In insurance claim data, the Observation Period can be considered as the time period the Person is enrolled with a payer.",No,,,No,,,,,,,,,,,No,,,Yes,0,,No,,,No,,,No,,,,'19500101',1,,"DATEADD(dd,1,GETDATE())",1,,Yes,OBSERVATION_PERIOD,OBSERVATION_PERIOD_START_DATE,1,,Yes,1,,,,,,Yes,1,,Yes,3,Threshold increased to 3% as the majority of failing rows are within a reasonable timeframe.,Yes,,,
PROCEDURE_OCCURRENCE,"cdm","procedure_concept_id","Yes",0,,"integer",0,,"The PROCEDURE_CONCEPT_ID field is recommended for primary use in analyses, and must be used for network studies. This is the standard concept mapped from the source value which represents a procedure","The CONCEPT_ID that the PROCEDURE_SOURCE_VALUE maps to. Only records whose source values map to standard concepts with a domain of ""Procedure"" should go in this table. [Accepted Concepts](https://athena.ohdsi.org/search-terms/terms?domain=Procedure&standardConcept=Standard&page=1&pageSize=15&query=).","No",,,"Yes",1,"Updated the thresholds to capture the expected state of mapping for the data source 2025S1","CONCEPT","CONCEPT_ID","Procedure",0,,,,,"Yes",0,,"Yes",0,,"Yes",5,,"No",,,"No",,,,,,,,,,,,,,,"No",,,,,,,,,,,,,"Yes",,,
"MEASUREMENT","cdm","measurement_source_value","No",,,"varchar(50)",0,,"This field houses the verbatim value from the source data representing the Measurement that occurred. For example, this could be an ICD10 or Read code.","This code is mapped to a Standard Measurement Concept in the Standardized Vocabularies and the original code is stored here for reference.","No",,,"No",,,,,,,,,,,"No",,,"Yes",100,,"No",,,"No",,,"Yes",1,"Updated the thresholds to capture the expected state of mapping for the data source 2025S1","MEASUREMENT_CONCEPT_ID",,,,,,,,,,,,"No",,,,,,,,,,,,,"Yes",,,
PROCEDURE_OCCURRENCE,cdm,procedure_source_value,No,,,varchar(50),0,,"This field houses the verbatim value from the source data representing the procedure that occurred. For example, this could be an CPT4 or OPCS4 code.",Use this value to look up the source concept id and then map the source concept id to a standard concept id.,No,,,No,,,,,,,,,,,No,,,Yes,100,,No,,,No,,,Yes,1,"Updated the thresholds to capture the expected state of mapping for the data source 2025S1",PROCEDURE_CONCEPT_ID,,,,,,,,,,,,No,,,,,,,,,,,,,Yes,,,
