cdmTableName,databaseSchema,cdmFieldName,isRequired,isRequiredThreshold,isRequiredNotes,cdmDatatype,cdmDatatypeThreshold,cdmDatatypeNotes,userGuidance,etlConventions,isPrimaryKey,isPrimaryKeyThreshold,isPrimaryKeyNotes,isForeignKey,isForeignKeyThreshold,isForeignKeyNotes,fkTableName,fkFieldName,fkDomain,fkDomainThreshold,fkDomainNotes,fkClass,fkClassThreshold,fkClassNotes,isStandardValidConcept,isStandardValidConceptThreshold,isStandardValidConceptNotes,measureValueCompleteness,measureValueCompletenessThreshold,measureValueCompletenessNotes,standardConceptRecordCompleteness,standardConceptRecordCompletenessThreshold,standardConceptRecordCompletenessNotes,sourceConceptRecordCompleteness,sourceConceptRecordCompletenessThreshold,sourceConceptRecordCompletenessNotes,sourceValueCompleteness,sourceValueCompletenessThreshold,sourceValueCompletenessNotes,standardConceptFieldName,plausibleValueLow,plausibleValueLowThreshold,plausibleValueLowNotes,plausibleValueHigh,plausibleValueHighThreshold,plausibleValueHighNotes,plausibleTemporalAfter,plausibleTemporalAfterTableName,plausibleTemporalAfterFieldName,plausibleTemporalAfterThreshold,plausibleTemporalAfterNotes,plausibleDuringLife,plausibleDuringLifeThreshold,plausibleDuringLifeNotes,plausibleStartBeforeEnd,plausibleStartBeforeEndFieldName,plausibleStartBeforeEndThreshold,plausibleStartBeforeEndNotes,plausibleAfterBirth,plausibleAfterBirthThreshold,plausibleAfterBirthNotes,plausibleBeforeDeath,plausibleBeforeDeathThreshold,plausibleBeforeDeathNotes,runForCohort,withinVisitDates,withinVisitDatesThreshold,withinVisitDatesNotes
OBSERVATION,cdm,observation_concept_id,Yes,0,,integer,0,,"The OBSERVATION_CONCEPT_ID field is recommended for primary use in analyses, and must be used for network studies.","The CONCEPT_ID that the OBSERVATION_SOURCE_CONCEPT_ID maps to. There is no specified domain that the Concepts in this table must adhere to. The only rule is that records with Concepts in the Condition, Procedure, Drug, Measurement, or Device domains MUST go to the corresponding table.",No,,,Yes,0,,CONCEPT,CONCEPT_ID,,,,,,,Yes,0,1/23/2025 failures are due to ICD10CMs mapping to deprecated concepts. Should be updated in Feb 2025 vocab release.,Yes,0,,Yes,5,,No,,,No,,,,,,,,,,,,,,,No,,,,,,,,,,,,,Yes,,,
CONDITION_OCCURRENCE,cdm,condition_status_concept_id,No,,,integer,0,,"This concept represents the point during the visit the diagnosis was given (admitting diagnosis, final diagnosis), whether the diagnosis was determined due to laboratory findings, if the diagnosis was exclusionary, or if it was a preliminary diagnosis, among others.","Choose the Concept in the Condition Status domain that best represents the point during the visit when the diagnosis was given. These can include admitting diagnosis, principal diagnosis, and secondary diagnosis. [Accepted Concepts](https://athena.ohdsi.org/search-terms/terms?domain=Condition+Status&standardConcept=Standard&page=1&pageSize=15&query=).",No,,,Yes,0,,CONCEPT,CONCEPT_ID,Condition Status,0,,,,,Yes,0,,Yes,100,,Yes,100,Threshold set to 100 as this data is not available.,No,,,No,,,,,,,,,,,,,,,,,,,,,,,,,,,,,,,
VISIT_OCCURRENCE,cdm,admitted_from_concept_id,No,,,integer,0,,"Use this field to determine where the patient was admitted from. This concept is part of the visit domain and can indicate if a patient was admitted to the hospital from a long-term care facility, for example.","If available, map the admitted_from_source_value to a standard concept in the visit domain. [Accepted Concepts](https://athena.ohdsi.org/search-terms/terms?domain=Visit&standardConcept=Standard&page=1&pageSize=15&query=). If a person was admitted from home, set this to 0.",No,,,Yes,0,,CONCEPT,CONCEPT_ID,Visit,0,,,,,Yes,0,,Yes,100,,Yes,100,Threshold set to 100 as this data is not available.,No,,,No,,,,,,,,,,,,,,,,,,,,,,,,,,,,,,,
VISIT_OCCURRENCE,cdm,discharged_to_concept_id,No,,,integer,0,,"Use this field to determine where the patient was discharged to after a visit. This concept is part of the visit domain and can indicate if a patient was transferred to another hospital or sent to a long-term care facility, for example.  It is assumed that a person is discharged to home therefore there is not a standard concept id for ""home"".  Use concept id = 0 when a person is discharged to home.","If available, map the discharged_to_source_value to a standard concept in the visit domain. [Accepted Concepts](https://athena.ohdsi.org/search-terms/terms?domain=Visit&standardConcept=Standard&page=1&pageSize=15&query=).",No,,,Yes,0,,CONCEPT,CONCEPT_ID,Visit,0,,,,,Yes,0,,Yes,100,,Yes,100,Threshold set to 100 as this data is not available.,No,,,No,,,,,,,,,,,,,,,,,,,,,,,,,,,,,,,
DRUG_EXPOSURE,cdm,drug_source_value,No,,,varchar(50),0,,"This field houses the verbatim value from the source data representing the drug exposure that occurred. For example, this could be an NDC or Gemscript code.",This code is mapped to a Standard Drug Concept in the Standardized Vocabularies and the original code is stored here for reference.,No,,,No,,,,,,,,,,,No,,,Yes,100,,No,,,No,,,Yes,27.5,Threshold increased to 27.5% since 27% of the distinct source values in this database have source concepts but no mappings to standard concepts. Looking into what these records are these are 2billion concepts with no mapping in the IQVIA concept relationship table to a custom concept.,DRUG_CONCEPT_ID,,,,,,,,,,,,No,,,,,,,,,,,,,Yes,,,